{"audit_round":1,"audit_target_sha":"9e4547abfff0cc91f588362527b23c48c02be833","content":"Audit checks verified at commit 9e4547abfff0cc91f588362527b23c48c02be833","evidence_id":"r1-audit-check-1158621ddef024e2","run_id":"run-5907e922c6838446050e5ef18233563be80cccfece2e490b6b48987cd91aad48","schema_version":"0.1"}