{"audit_round":1,"audit_target_sha":"fe0981326567cbd3482a006878a8c833efd4532a","content":"Audit checks verified at commit fe0981326567cbd3482a006878a8c833efd4532a","evidence_id":"r1-audit-check-485ded284ff9e7c5","run_id":"run-0c56354aee495a4ec949a0b542a7875629251a3e6ca936f39498b297ebbe3250","schema_version":"0.1"}